{
  "$schema": "./schema/review.schema.json",
  "reviewed_on": "2026-10-15",
  "title": "Resume and STAR review for Amazon Solutions Architect preparation",
  "summary": "The resume has strong quantified engineering examples. The main weakness is the explanation between the problem and the numbers: customer stakes, your own decision, the alternative, and how the result was measured. For the recruiter-confirmed AWSI-ETP Solutions Architect role, lead with S1, S2, S4, and S5 after confirming those details. Translate the mechanism into customer outcomes, and adapt the explanation for engineers and executives. This is a qualitative preparation review, not an Amazon evaluation or a prediction of an offer.",
  "resume_source": "Anuvik_Thota_Resume.pdf supplied by the user; one-page extracted resume reviewed on 2026-10-15.",
  "evidence_policy": "Resume-supported means the PDF contains the claim; it is not independently verified. Existing story scripts are drafts, not source evidence. Proposed lessons, motivations, dialogue, mechanisms, ownership scope, and decision rationales need confirmation. Never add a deadline, conflict, customer quote, audit guarantee, or measured outcome simply to complete STAR.",
  "privacy": "Drafts and rehearsal notes save in this browser on this device through local storage; they are not sent to a server by this page. Shared-browser users can read saved notes, exports contain them, and clearing browser site data removes them. Keep confidential customer and financial details out of notes and exported files.",
  "guidance": "Amazon recommends STAR, relevant data, and clarity about your own contributions. The readiness labels and the 90-second core/3-minute follow-up exercise below are editorial practice tools, not an official rubric or fixed answer time.",
  "guidance_sources": [
    "amazon-star",
    "amazon-lps"
  ],
  "readiness_options": [
    {
      "id": "needs-confirmation",
      "label": "Needs evidence details"
    },
    {
      "id": "needs-outcome",
      "label": "Needs outcome or milestone"
    },
    {
      "id": "overlapping-angle",
      "label": "Same episode, alternate angle"
    }
  ],
  "discrepancies": [
    {
      "id": "msr-dates",
      "resume": "MSRcosmos: May 2026 to Aug 2026.",
      "previous": "Site profile: Jun 2026 to Aug 2026.",
      "action": "Site profile is aligned to the PDF, including legal_dates. Confirm exact dates against your records before forms or background checks."
    },
    {
      "id": "sports-role",
      "resume": "USC Sports Analytics: AI/ML Research Intern, Jun 2025 to Sep 2025.",
      "previous": "Site profile and S8: volunteer research.",
      "action": "Display the PDF title; volunteer status is not established by the supplied PDF. Reconcile official classification with your appointment records."
    },
    {
      "id": "oracle-tenure",
      "resume": "Oracle: Jul 2022 to Jan 2025, approximately two and a half years by month boundaries.",
      "previous": "Site required the phrase close to 3 years.",
      "action": "Use the exact dates or the approximate duration consistently; month-only dates do not establish exact days of service."
    },
    {
      "id": "unsupported-details",
      "resume": "PDF gives tools, actions, and reported metrics; it does not claim sole ERP ownership, guaranteed audit compliance, no unchecked mistakes, or particular persuasion tactics.",
      "previous": "Story drafts asserted sole engineer, zero unchecked records, universal INT8 conclusions, and 40% faster DQN runs.",
      "action": "Use evidence-bounded wording and [confirm: ...] prompts. Runtime reduction is about 40%; benchmark conclusions depend on model, hardware, workload, and comparator."
    },
    {
      "id": "cloud-boundary",
      "resume": "Oracle containers and Kubernetes were on OCI. MSRcosmos describes cloud-agnostic Docker and Databricks workspaces across AWS, Azure, and GCP.",
      "previous": "AWS design analogies could be read as services already implemented.",
      "action": "Call native AWS mappings proposed designs. Be precise about what AWS services you actually configured versus studied."
    },
    {
      "id": "resume-coverage",
      "resume": "Marshall ETL/survey validation and the fraud GNN (0.923 ROC-AUC, +0.03 over XGBoost) appear in the PDF.",
      "previous": "The current 12-story bank does not include these as separate STAR stories.",
      "action": "Keep as reserve material. Marshall needs ownership, validation examples, and an outcome; the GNN needs split/leakage controls, class imbalance, and why ROC-AUC suited the use case. Do not invent customer or production impact."
    }
  ],
  "stories": [
    {
      "id": "erp-hitl",
      "story_id": "erp-hitl",
      "code": "S1",
      "title": "Multi-agent ERP migration with human-in-the-loop",
      "episode_id": "erp-migration",
      "readiness": "needs-confirmation",
      "evidence_status": "Resume-supported claims, not independently verified; personal narrative details still need confirmation.",
      "evidence": [
        "10,000+ GL/AP/AR records; Sage X3 to Intacct; 12 entities.",
        "Claude API, LangGraph, Docker; human-review routing; 68% less manual reconciliation, 83% auto-approval, 3 days to 5.5 hours."
      ],
      "strengths": [
        "Strong customer-facing anchor with a clear before/after.",
        "Human review makes the automation boundary a natural architectural decision."
      ],
      "missing": [
        "Who set the acceptance criteria and what you personally owned.",
        "Threshold calibration, exception checks, real tradeoff, and measurement window."
      ],
      "assessment": {
        "stakes": "Financial-record accuracy is plausible context; audit obligations, cutoff dates, and impact must be confirmed.",
        "ownership": "The resume says designed and launched; it does not establish sole engineering ownership.",
        "decision": "LangGraph and confidence routing are named, but the rejected alternative and rationale are absent.",
        "tradeoff": "Automation versus review workload is a useful discussion; actual threshold error rates are missing.",
        "measurement": "Define reconciliation effort, turnaround start/end, sample size, and whether all metrics share the same cohort."
      },
      "probes": [
        "What did the finance stakeholder ask you to protect, in their own words?",
        "What was one record that automation could not safely approve, and how was it handled?",
        "How did you validate 83% auto-approval without interpreting confidence as correctness?",
        "Were 68% effort reduction and 3-day to 5.5-hour turnaround measured over the same entities and period?"
      ],
      "delivery": [
        "Open with turnaround, then briefly explain GL/AP/AR as financial records.",
        "Paint one actual reviewer decision; do not invent a customer quote, audit event, or zero-error claim.",
        "For engineers, explain confidence routing, independent validation, and safe replay. For executives, explain the reported turnaround from 3 days to 5.5 hours and the reviewer decision boundary. Confirm the measurement and stakeholder acceptance; do not claim audit compliance or zero errors."
      ],
      "draft": "At MSRcosmos, I worked on moving financial records from Sage X3 to Sage Intacct across 12 client entities. The problem was to reduce reconciliation work while preserving a human review path. [confirm: the specific stakeholder requirement and my ownership boundary]. I built the workflow with the Claude API and LangGraph, and designed routing over Sage REST APIs and MCP tools. Records above a confidence threshold were auto-approved; other cases went to reviewers. [confirm: how that threshold was validated and one alternative I rejected]. The reported results were 68% less manual reconciliation and turnaround from 3 days to 5.5 hours. I would explain the measurement window before attributing the full change to my work. [confirm: one genuine lesson and what I changed afterward]."
    },
    {
      "id": "p1-mttr",
      "story_id": "p1-mttr",
      "code": "S2",
      "title": "P1 MTTR from 94 to 26 minutes",
      "episode_id": "oracle-diagnostics",
      "readiness": "needs-confirmation",
      "evidence_status": "Resume-supported claims, not independently verified; personal narrative details still need confirmation.",
      "evidence": [
        "Real-time API diagnostics on high-throughput event streams across 1M+ endpoints.",
        "Root-cause tags and runbook context; P1 MTTR reported from 94 to 26 minutes."
      ],
      "strengths": [
        "Very clear operational result and credible technical depth.",
        "Fits Deliver Results and Dive Deep when anchored in one decision."
      ],
      "missing": [
        "One actual incident rather than a platform-wide retrospective.",
        "Incident sample, mean-versus-median definition, rollout, and false diagnoses."
      ],
      "assessment": {
        "stakes": "P1 severity suggests urgency, but affected customers and the actual service impact are unspecified.",
        "ownership": "Instrumenting and tagging are in the resume; exact design and rollout ownership need confirmation.",
        "decision": "The tag logic and choice between rules and a model are not given.",
        "tradeoff": "Diagnostic speed versus false confidence, telemetry cost, and cardinality need actual examples.",
        "measurement": "MTTR is 94 to 26 minutes, about 72% lower; incident count, time window, and other changes are missing."
      },
      "probes": [
        "Walk through one P1 from first signal to mitigation, naming your own intervention.",
        "What fields produced a root-cause tag, and when was it wrong?",
        "What other changes could explain part of the MTTR decrease?",
        "How did you avoid leaking tenant data in diagnostic context?"
      ],
      "delivery": [